{
  "$comment": "Code generated by go run ./tools/generate; DO NOT EDIT.",
  "$defs": {
    "#JSONValue": {
      "anyOf": [
        {
          "type": "null"
        },
        {
          "type": "boolean"
        },
        {
          "type": "string"
        },
        {
          "type": "number"
        },
        {
          "items": {
            "$ref": "#/$defs/%23JSONValue"
          },
          "type": "array"
        },
        {
          "additionalProperties": {
            "$ref": "#/$defs/%23JSONValue"
          },
          "type": "object"
        }
      ]
    },
    "#NonEmptyString": {
      "pattern": "\\S",
      "type": "string"
    },
    "#ObjectReference": {
      "additionalProperties": false,
      "minProperties": 1,
      "properties": {
        "entity_id": {
          "$ref": "#/$defs/%23NonEmptyString"
        },
        "task_id": {
          "$ref": "#/$defs/%23NonEmptyString"
        }
      },
      "type": "object"
    }
  },
  "$schema": "https://json-schema.org/draft/2020-12/schema",
  "additionalProperties": false,
  "properties": {
    "content_type": {
      "type": "string"
    },
    "extra": {
      "additionalProperties": {
        "$ref": "#/$defs/%23JSONValue"
      },
      "type": "object"
    },
    "object_id": {
      "$ref": "#/$defs/%23NonEmptyString"
    },
    "path": {
      "type": "string"
    },
    "referenced_by": {
      "items": {
        "$ref": "#/$defs/%23ObjectReference"
      },
      "type": "array"
    },
    "size_bytes": {
      "minimum": 0,
      "type": "integer"
    },
    "type": {
      "type": "string"
    },
    "usage_hints": {
      "items": {
        "$ref": "#/$defs/%23NonEmptyString"
      },
      "type": "array"
    }
  },
  "required": [
    "object_id"
  ],
  "type": "object",
  "x-atlas-protocol-revision": "sha256:34f1d574778ba998322c664e187718eb3f91fc73ca95aeb0161a6b4b0c7880e3"
}
